{
  "protocol": "focusir",
  "version": 1,
  "kind": "response",
  "request_id": "11111111-1111-4111-8111-111111111112",
  "status": "accepted",
  "boot_id": "44444444-4444-4444-8444-444444444444",
  "server_mono_ms": "127000",
  "result": {
    "task_id": "55555555-5555-4555-8555-555555555555",
    "state": "QUEUED"
  }
}
