{
  "protocol": "focusir",
  "version": 1,
  "kind": "response",
  "request_id": "11111111-1111-4111-8111-111111111111",
  "status": "ok",
  "boot_id": "44444444-4444-4444-8444-444444444444",
  "server_mono_ms": "127000",
  "result": {
    "session_id": "22222222-2222-4222-8222-222222222222",
    "selected_version": 1,
    "role": "operator",
    "heartbeat_interval_ms": 1000,
    "heartbeat_timeout_ms": 5000,
    "limits": { "maximum_message_bytes": 262144, "maximum_connections": 4 }
  }
}
